{
  "$ref": "#/definitions/library-meta",
  "definitions": {
    "library-meta": {
      "type": "object",
      "properties": {
        "model": {
          "type": "object",
          "properties": {
            "name": {
              "type": "string",
              "default": ""
            },
            "license": {
              "type": "string",
              "default": ""
            }
          },
          "additionalProperties": false,
          "default": {}
        },
        "seeds": {
          "type": "object",
          "additionalProperties": {
            "type": "integer"
          },
          "default": {}
        },
        "prompts": {
          "type": "object",
          "additionalProperties": {
            "type": "string"
          },
          "default": {}
        },
        "date": {
          "type": "string",
          "default": ""
        },
        "approver": {
          "type": "string",
          "default": ""
        },
        "grounding": {
          "type": "array",
          "items": {
            "type": "string"
          },
          "default": []
        },
        "notes": {
          "type": "array",
          "items": {
            "type": "string"
          },
          "default": []
        }
      },
      "additionalProperties": false
    }
  },
  "$schema": "http://json-schema.org/draft-07/schema#"
}
